,isEdited,rating,title,userName,date,review
187,False,3,Change in layout,First Forays,2020-01-26 04:10:11,The recent change of playing the tabs on the left of the screen is very very difficult to use. Especially the majority right-handers. Also the trends all look like paid ones! Not enjoying it much anymore.
188,False,4,Finally loading images instead of weblinks,anirudhgunda,2019-10-17 11:40:22,This is something good from Twitter at least by now they’ve implemented loading of images internally than just putting links to media
189,False,3,Trending,Shazunu6587,2019-10-17 09:06:08,"App is great but from last update Trending for selected location not working. I selected other location than the current but Trending today always on the current location. 
Previously it was worked now it’s not loading on precised location."
190,False,5,Preview,SachdevaZ,2019-08-23 03:06:24,"Excellent social network above all other platforms of social media . It keeps you up dated with latest , in the field for which you are always eager to know ."
191,False,5,Good medium for Updates,Parveen Khan 2019,2019-06-18 16:46:00,I’m able to get/receive information more quickly. It gives me more deeper content and an opportunity to express myself.
192,False,5,Better social network,Jeet Mudgal,2021-09-24 19:10:01,This app is really on the top but I think it should be a function of showing online person . It’s good for conversation
193,False,5,You should improve.,1059why,2021-05-05 03:42:33,"If I am a sending message, whether it is delivered or read should be known to the sender. Today, this communication only helps to send, but ordinarily people in darkness."
194,False,4,Bad Refresh Sound,uncoolbro,2021-07-17 09:56:49,I don’t know whats going on whenever i refresh the feed there’s a very annoying sound and even with less than 50% ringer volume app refresh sound is always 100%
195,False,5,Great way of keeping updated,Syed Huq,2021-04-08 13:30:04,Very convenient way to keep receiving news and articles of interest on mobile
196,False,5,Great app,Mandeep Saijpal,2021-02-23 20:47:42,Hey tweeter if some celebrity or person with followers in millions if they write something wrong also take action against them as u do to common people hope u will understand feelings of an ordinary human
197,False,5,Not at all working,Mallhar,2020-04-22 18:45:58,"The app isn’t working at all. Showing everything blank. Have tried uninstall install, still the same."
198,False,5,Problem to see pictures or video,patel girl,2020-03-10 06:16:25,I had joined Twitter one week before but I can not see any pictures or video so plz kindly help with this problem plz plz
199,False,1,Biased and opaque platform.,Frustrated-Twitter-User,2019-05-07 16:48:56,"Extremely biased platform. Promotes Hinduphobia. Promotes only certain ideologies while drowning others. 
Actively working to promote anti-BJP sentiment among the Indian voter during Indian elections 2019. 
Accounts are suspended without clarity of why this was done...policy and rules are ambiguous and opaque and used to fit Twitter’s own ideology. 
All in all - a platform that promotes anything but free speech and empowerment.
Like me, millions of Indian users are using it only because right now there seems to be no other alternative."
